361,Placing images on the world map: A microblog-based enrichment approach,"Hauff, C. and Houben, G.-J.",REJECTED,UNCLASSIFIED,2012, International ACM SIGIR Conference on Research and Development in Information Retrieval,"(E2) the primary study is related to volunteered geographic information, but it is not related to quality assessment; ",,,,,,
362,Predicting geo-informative attributes in large-scale image collections using convolutional neural networks,"Lee, S. and Zhang, H. and Crandall, D.J.",REJECTED,UNCLASSIFIED,2015,IEEE Winter Conference on Applications of Computer Vision,"(E2) the primary study is related to volunteered geographic information, but it is not related to quality assessment; ",,,,,,
363,Predicting the topic influence trends in social media with multiple models,"Han, Y.a  b  and Fang, B.b  c  and Jia, Y.b ",REJECTED,UNCLASSIFIED,2014,Neurocomputing,"(E2) the primary study is related to volunteered geographic information, but it is not related to quality assessment; ",,,,,,
364,Predicting Well-being with Geo-referenced Data Collected from Social Media Platforms,"Loff, Joao and Reis, Manuel and Martins, Bruno",REJECTED,UNCLASSIFIED,2015,30th Annual ACM Symposium on Applied Computing,"(E2) the primary study is related to volunteered geographic information, but it is not related to quality assessment; ",,,,,,
365,Prediction of user location using the radiation model and social check-ins,"Tarasov, A.a  and Kling, F.b  and Pozdnoukhov, A.c ",REJECTED,UNCLASSIFIED,2013,International Conference on Knowledge Discovery and Data Mining,(E9) the primary study is not related to quality assessment or volunteered geographic information; ,,,,,,
366,Privacy-preserving  Publication of  Provenance  Workflows,"Maruseac, Mihai and Ghinita, Gabriel and Rughinis, Razvan",REJECTED,UNCLASSIFIED,2014,4th  ACM Conference on Data and  Application Security and Privacy,(E9) the primary study is not related to quality assessment or volunteered geographic information; ,,,,,,
367,Probabilistic Convex Hull Queries over Uncertain Data,"Yan, Da and Zhao, Zhou and Ng, Wilfred and Liu, Steven",REJECTED,UNCLASSIFIED,2015,IEEE Transactions on Knowledge and Data Engineering,(E9) the primary study is not related to quality assessment or volunteered geographic information; ,,,,,,
368,Prospects and challenges of rendering tissue density in Hounsfield units for cone beam computed tomography,"Molteni, R.",REJECTED,UNCLASSIFIED,2013,"Oral Surgery, Oral Medicine, Oral Pathology and Oral Radiology",(E9) the primary study is not related to quality assessment or volunteered geographic information; ,,,,,,
369,Proximate sensing using georeferenced community contributed photo collections,"Leung, D. and Newsam, S.",REJECTED,UNCLASSIFIED,2009,ACM International Symposium on Advances in Geographic Information Systems,"(E2) the primary study is related to volunteered geographic information, but it is not related to quality assessment; ",,,,,,
370,Purposive hidden-object-game: Embedding human computation in popular game,"Ni, Y. and Dong, J. and Feng, J. and Yan, S.",REJECTED,UNCLASSIFIED,2011,ACM Multimedia Conference and Co-Located Workshops,(E9) the primary study is not related to quality assessment or volunteered geographic information; ,,,,,,
371,Putting  Ubiquitous  Crowd-sourcing into  Context,"Mashhadi, Afra and Quattrone, Giovanni and Capra, Licia",REJECTED,UNCLASSIFIED,2013,Conference on  Computer  Supported  Cooperative  Work,"(E2) the primary study is related to volunteered geographic information, but it is not related to quality assessment; ",,,,,,
372,QualEvS4Geo: A peer-to-peer system architecture for semi-automated quality evaluation of geo-data in SDI,"Mobasheri, A.a  and Zipf, A.a  and Bakillah, M.a  b  and Liang, S.H.L.c ",REJECTED,UNCLASSIFIED,2013,3rd International Conference on Innovative Computing Technology,"(E1) the primary study is related to quality assessment, but it is not related to volunteered geographic information; ",,,,,,
373,Qualitative matching of spatial information,"Wallgrun, J.O.a  and Wolter, D.b  and Richter, K.-F.a ",REJECTED,UNCLASSIFIED,2010,International Symposium on Advances in Geographic Information Systems,"(E2) the primary study is related to volunteered geographic information, but it is not related to quality assessment; ",,,,,,
374,Quality-aware similarity assessment for entity matching in Web data ,Surender Reddy Yerva and Zoltan Miklos and Karl Aberer,REJECTED,UNCLASSIFIED,2012,Information Systems ,(E9) the primary study is not related to quality assessment or volunteered geographic information; ,,,,,,
375,Rare is  Interesting:  Connecting  Spatio-temporal  Behavior  Patterns with  Subjective  Image  Appeal,"Yildirim, Gokhan and Susstrunk, Sabine",REJECTED,UNCLASSIFIED,2013,2nd  ACM  International  Workshop on  Geotagging and  Its  Applications in  Multimedia,"(E2) the primary study is related to volunteered geographic information, but it is not related to quality assessment; ",,,,,,
376,Reading between the Lines: Object localization using implicit cues from image tags,"Hwang, S.J. and Grauman, K.",REJECTED,UNCLASSIFIED,2012,IEEE Transactions on Pattern Analysis and Machine Intelligence,"(E2) the primary study is related to volunteered geographic information, but it is not related to quality assessment; ",,,,,,
377,Realising the full potential of citizen science monitoring programs ,Ayesha I.T. Tulloch and Hugh P. Possingham and Liana N. Joseph and Judit Szabo and Tara G. Martin,REJECTED,UNCLASSIFIED,2013,Biological Conservation ,"(E2) the primary study is related to volunteered geographic information, but it is not related to quality assessment; ",,,,,,
378,Real-time  Spatio-temporal  Analysis of  West  Nile  Virus  Using  Twitter  Data,"Sugumaran, Ramanathan and Voss, Jonathan",REJECTED,UNCLASSIFIED,2012,Proceedings of the 3rd  International  Conference on  Computing for  Geospatial  Research and  Applications,"(E2) the primary study is related to volunteered geographic information, but it is not related to quality assessment; ",,,,,,
379,Real-Time Visual Concept Classification,"Uijlings, Jasper R. R. and Smeulders, Arnold W. M. and Scha, Remko J. H.",REJECTED,UNCLASSIFIED,2010,Transactions on Multimedia,(E9) the primary study is not related to quality assessment or volunteered geographic information; ,,,,,,
380,Recommending Fair Payments for Large-Scale Social Ridesharing,"Bistaffa, Filippo and Farinelli, Alessandro and Chalkiadakis, Georgios and Ramchurn, Sarvapali D.",REJECTED,UNCLASSIFIED,2015,Proceedings of the 9th ACM Conference on Recommender Systems,(E9) the primary study is not related to quality assessment or volunteered geographic information; ,,,,,,
381,Reliable Diversity-based Spatial Crowdsourcing by Moving Workers,"Cheng, Peng and Lian, Xiang and Chen, Zhao and Fu, Rui and Chen, Lei and Han, Jinsong and Zhao, Jizhong",REJECTED,UNCLASSIFIED,2015,Proc. VLDB Endow.,"(E2) the primary study is related to volunteered geographic information, but it is not related to quality assessment; ",,,,,,
382,Remote transmitter tracking with Raytraced fingerprint database,"De Groot, E.a  and Bose, T.a  and Cooper, C.b  and Kruse, M.b ",REJECTED,UNCLASSIFIED,2014,IEEE Military Communications Conference ,"(E2) the primary study is related to volunteered geographic information, but it is not related to quality assessment; ",,,,,,
383,Reputation-based crowdsourced Wi-Fi topology discovery ,Pantelis A. Frangoudis and George C. Polyzos,REJECTED,UNCLASSIFIED,2015,Computer Networks ,(E9) the primary study is not related to quality assessment or volunteered geographic information; ,,,,,,
384,"Rich Location-driven Tag Cloud Suggestions Based on Public, Community, and Personal Sources","Joshi, Dhiraj and Luo, Jiebo and Yu, Jie and Lei, Phoury and Gallagher, Andrew",REJECTED,UNCLASSIFIED,2010,Proceedings of the 1st  ACM  International  Workshop on  Connected  Multimedia,(E9) the primary study is not related to quality assessment or volunteered geographic information; ,,,,,,
385,"Right time, right place health communication on twitter: Value and accuracy of location information","Burton, S.H.a  and Tanner, K.W.a  and Giraud-Carrier, C.G.a  and West, J.H.b  and Barnes, M.D.b ",REJECTED,UNCLASSIFIED,2012,Journal of Medical Internet Research,"(E2) the primary study is related to volunteered geographic information, but it is not related to quality assessment; ",,,,,,
386,Road recognition using coarse-grained vehicular traces,"Liu, X.a  and Zhu, Y.a  and Wang, Y.b  and Forman, G.b  and Ni, L.M.c  and Fang, Y.a  and Li, M.a ",REJECTED,UNCLASSIFIED,2012,HP Laboratories Technical Report,(E9) the primary study is not related to quality assessment or volunteered geographic information; ,,,,,,
387,Robust and Trusted Crowd-Sourcing and Crowd-Tasking in the Future Internet,"Havlik, D. and Egly, M. and Huber, H. and Kutschera, P. and Falgenhauer, M. and Cizek, M.",REJECTED,UNCLASSIFIED,2013,IFIP Advances in Information and Communication Technology,"(E2) the primary study is related to volunteered geographic information, but it is not related to quality assessment; ",,,,,,
388,Robust detection of hyper-local events from geotagged social media data,"Xie, K. and Xia, C. and Grinberg, N. and Schwartz, R. and Naaman, M.",REJECTED,UNCLASSIFIED,2013,13th International Workshop on Multimedia Data Mining,"(E2) the primary study is related to volunteered geographic information, but it is not related to quality assessment; ",,,,,,
389,Sais: Smartphone augmented infrastructure sensing for public safety and sustainability in smart cities,"Liao, C.-C.a  and Hou, T.-F.a  and Lin, T.-Y.a  and Cheng, Y.-J.a  and Erbad, A.b  and Hsu, C.-H.a  and Venkatasubramanian, N.c ",REJECTED,UNCLASSIFIED,2014,1st International Workshop on Emerging Multimedia Applications and Services for Smart Cities,(E9) the primary study is not related to quality assessment or volunteered geographic information; ,,,,,,
390,Scalable  Logo  Recognition in  Real-world  Images,"Romberg, Stefan and Pueyo, Lluis Garcia and Lienhart, Rainer and van Zwol, Roelof",REJECTED,UNCLASSIFIED,2011,Proceedings of the 1st  ACM  International  Conference on  Multimedia  Retrieval,"(E2) the primary study is related to volunteered geographic information, but it is not related to quality assessment; ",,,,,,
391,Scalable Spatial Crowdsourcing: A Study of Distributed Algorithms,"Alfarrarjeh, A.; Emrich, T. & Shahabi, C",REJECTED,UNCLASSIFIED,2015,6th IEEE International Conference on Mobile Data Management,(E9) the primary study is not related to quality assessment or volunteered geographic information; ,,,,,,
392,SEA: A System for Event Analysis on Chinese Tweets,"Wang, Yaqiong and Liu, Hongfu and Lin, Hao and Wu, Junjie and Wu, Zhiang and Cao, Jie",REJECTED,UNCLASSIFIED,2013,19th  ACM  SIGKDD  International  Conference on  Knowledge  Discovery and  Data  Mining,"(E2) the primary study is related to volunteered geographic information, but it is not related to quality assessment; ",,,,,,
393,Securing Crisis Maps in Conflict Zones,"Chamales, G. & Baker, R.",REJECTED,UNCLASSIFIED,2011,Global Humanitarian Technology Conference,"(E2) the primary study is related to volunteered geographic information, but it is not related to quality assessment; ",,,,,,
394,Semantic  Enrichment of  Mobile  Phone  Data  Records,"Dashdorj, Zolzaya and Serafini, Luciano and Antonelli, Fabrizio and Larcher, Roberto",REJECTED,UNCLASSIFIED,2013,12th  International  Conference on  Mobile and  Ubiquitous  Multimedia,"(E2) the primary study is related to volunteered geographic information, but it is not related to quality assessment; ",,,,,,
395,Semantic  Keyword-based  Retrieval of  Photos  Taken with  Mobile  Devices,"Viana, Windson and Hammiche, Samira and Moisuc, Bogdan and Villanova-Oliver, Marlene and Gensel, Jerome and Martin, Herve",REJECTED,UNCLASSIFIED,2008,6th  International  Conference on  Advances in  Mobile  Computing and  Multimedia,(E9) the primary study is not related to quality assessment or volunteered geographic information; ,,,,,,
396,Semantic Positioning - An Innovative Approach for Providing Location-Based Services Based on the Web of Data,"Uzun, A.; Salem, M. & Kupper, A.",REJECTED,UNCLASSIFIED,2013,IEEE Seventh International Conference on Semantic Computing,"(E2) the primary study is related to volunteered geographic information, but it is not related to quality assessment; ",,,,,,
397,Semantically  Meaningful  Group  Detection  Within  Sub-communities of  Twitter  Blogosphere:  A  Topic  Oriented  Multi-objective  Clustering  Approach,"Sotiropoulos, Dionisios N. and Kounavis, Chris D. and Giaglis, George M.",REJECTED,UNCLASSIFIED,2013, International  Conference on  Advances in  Social  Networks  Analysis and  Mining,(E9) the primary study is not related to quality assessment or volunteered geographic information; ,,,,,,
398,Semi-automatic interpretation of buildings and settlement areas in user-generated spatial data,"Werder, S. and Kieler, B. and Sester, M.",REJECTED,UNCLASSIFIED,2010,ACM International Symposium on Advances in Geographic Information Systems,"(E2) the primary study is related to volunteered geographic information, but it is not related to quality assessment; ",,,,,,
399,Shopaholic:  A  Crowd-sourced  Spatio-temporal  Product-deals  Evaluation  System ( Demo  Paper),"Rathinavel, Kruthika and Dixit, Gaurav and Matarazzo, Michael and Lu, Chang-Tien",REJECTED,UNCLASSIFIED,2014,5th  ACM SIGSPATIAL  International  Workshop on  GeoStreaming,(E9) the primary study is not related to quality assessment or volunteered geographic information; ,,,,,,
400,SIEGE: Service-Independent Enterprise-GradE protection against password scans,"Waldvogel, M. and Kollek, J.",REJECTED,UNCLASSIFIED,2014,Lecture Notes in Informatics,(E9) the primary study is not related to quality assessment or volunteered geographic information; ,,,,,,
401,Simple  Supervised  Document  Geolocation with  Geodesic  Grids,"Wing, Benjamin P. and Baldridge, Jason",REJECTED,UNCLASSIFIED,2011,49th  Annual  Meeting of the  Association for  Computational  Linguistics:  Human  Language  Technologies ,(E9) the primary study is not related to quality assessment or volunteered geographic information; ,,,,,,
402,Simulation of the adaptive multivariate exploration for routes guidance,"Romsaiyud, W.",REJECTED,UNCLASSIFIED,2013,5th International Conference on Intelligent Networking and Collaborative Systems,(E9) the primary study is not related to quality assessment or volunteered geographic information; ,,,,,,
403,Simultaneous localization and mapping for pedestrians using only foot-mounted inertial sensors,"Robertson, P.a  and Angermann, M.a  and Krach, B.b ",REJECTED,UNCLASSIFIED,2009,ACM International Conference Proceeding Series,(E9) the primary study is not related to quality assessment or volunteered geographic information; ,,,,,,
404,Smart Mobility Policies with Evolutionary Algorithms: The Adapting Info Panel Case,"Stolfi, Daniel H. and Alba, Enrique",REJECTED,UNCLASSIFIED,2015,Annual Conference on Genetic and Evolutionary Computation,"(E2) the primary study is related to volunteered geographic information, but it is not related to quality assessment; ",,,,,,
405,Social Eye Tracking: Gaze Recall with Online Crowds,"Cheng, Shiwei and Sun, Zhiqiang and Ma, Xiaojuan and Forlizzi, Jodi L. and Hudson, Scott E. and Dey, Anind",REJECTED,UNCLASSIFIED,2015,18th ACM Conference on Computer Supported Cooperative Work and Social Computing,"(E2) the primary study is related to volunteered geographic information, but it is not related to quality assessment; ",,,,,,
406,SocRoutes: Safe Routes Based on Tweet Sentiments,"Kim, Jaewoo and Cha, Meeyoung and Sandholm, Thomas",REJECTED,UNCLASSIFIED,2014,23rd  International  Conference on  World  Wide  Web  Companion,"(E2) the primary study is related to volunteered geographic information, but it is not related to quality assessment; ",,,,,,
407,Some legal concerns with the use of crowd-sourced Geospatial Information,"Cho, George",REJECTED,UNCLASSIFIED,2014,7th International Remote Sensing and GIS Conference and Exhibition,"(E2) the primary study is related to volunteered geographic information, but it is not related to quality assessment; ",,,,,,
408,Spatial  Dissemination  Metrics for  Location-based  Social  Networks,"Lima, Antonio and Musolesi, Mirco",REJECTED,UNCLASSIFIED,2012,ACM  Conference on  Ubiquitous  Computing,(E9) the primary study is not related to quality assessment or volunteered geographic information; ,,,,,,
409,Spatial  Influence vs.  Community  Influence:  Modeling the  Global  Spread of  Social  Media,"Kamath, Krishna Y. and Caverlee, James and Cheng, Zhiyuan and Sui, Daniel Z.",REJECTED,UNCLASSIFIED,2012,21st  ACM  International  Conference on  Information and  Knowledge  Management,(E9) the primary study is not related to quality assessment or volunteered geographic information; ,,,,,,
410,Spatial  Semantic  Search in  Location-based  Web  Services,"Park, Jeong-Hoon",REJECTED,UNCLASSIFIED,2014,23rd  International  Conference on  World  Wide  Web  Companion,(E9) the primary study is not related to quality assessment or volunteered geographic information; ,,,,,,
411,Spatial accuracy 2.0,"Goodchild, Michael F.",REJECTED,UNCLASSIFIED,2008,8th International Symposium on Spatial Accuracy Assessment in Natural Resources and Environmental Science,"(E1) the primary study is related to quality assessment, but it is not related to volunteered geographic information; ",,,,,,
412,Spatial Topic Modeling in Online Social Media for Location Recommendation,"Bo Hu, Martin Ester",REJECTED,UNCLASSIFIED,2013,7th ACM conference on Recommender systems,"(E2) the primary study is related to volunteered geographic information, but it is not related to quality assessment; ",,,,,,
413,Spatio-temporal  Meme  Prediction:  Learning  What  Hashtags  Will  Be  Popular  Where,"Kamath, Krishna Y. and Caverlee, James",REJECTED,UNCLASSIFIED,2013,22nd  ACM  International  Conference on  Conference on  Information and  Knowledge  Management,(E9) the primary study is not related to quality assessment or volunteered geographic information; ,,,,,,
414,Spatiotemporal  Transformation of  Social  Media  Geostreams:  A  Case  Study of  Twitter for  Flu  Risk  Analysis,"Hwang, Myung-Hwa and Wang, Shaowen and Cao, Guofeng and Padmanabhan, Anand and Zhang, Zhenhua",REJECTED,UNCLASSIFIED,2013,4th  ACM  SIGSPATIAL  International  Workshop on  GeoStreaming,"(E2) the primary study is related to volunteered geographic information, but it is not related to quality assessment; ",,,,,,
415,Spatio-temporal and  Events  Based  Analysis of  Topic  Popularity in  Twitter,"Ardon, Sebastien and Bagchi, Amitabha and Mahanti, Anirban and Ruhela, Amit and Seth, Aaditeshwar and Tripathy, Rudra Mohan and Triukose, Sipat",REJECTED,UNCLASSIFIED,2013,22nd  ACM  International  Conference on  Conference on  Information and Knowledge  Management,"(E2) the primary study is related to volunteered geographic information, but it is not related to quality assessment; ",,,,,,
416,Spatiotemporal behavior profiling: A treasure hunt case study,"de Graaff, V. and Pfoser, D. and Van Keulen, M. and de By, R.A.",REJECTED,UNCLASSIFIED,2015,Lecture Notes in Computer Science ,(E9) the primary study is not related to quality assessment or volunteered geographic information; ,,,,,,
417,Spatio-Temporal Decision Support System for Natural Crisis Management with TweetComP1,"Middleton, S.E.a  and Zielinski, A.b  and Necmioglu, O.  and Hammitzsch, M.d ",REJECTED,UNCLASSIFIED,2014,Lecture Notes in Business Information Processing,"(E2) the primary study is related to volunteered geographic information, but it is not related to quality assessment; ",,,,,,
418,Spatio-temporal provenance: Identifying location information from unstructured text,"Lee, K.a  and Ganti, R.a  and Srivatsa, M.a  and Mohapatra, P.b ",REJECTED,UNCLASSIFIED,2013,International Conference on Pervasive Computing and Communications Workshops,"(E2) the primary study is related to volunteered geographic information, but it is not related to quality assessment; ",,,,,,
419,Storage and Processing of the Results of Water Quality Investigations of Streamflows. ,"Hock, Bela and Schneider, Jolan",REJECTED,UNCLASSIFIED,1986,Vizugyi Kozlemenyek,(E11) the primary study has not been published between 2005 and 2015;,,,,,,
420,Sub word and spatiotemporal models for identifying actionable information in Haitian Kreyol,"Munro, R.",REJECTED,UNCLASSIFIED,2011,15th Conference on Computational Natural Language Learning,"(E2) the primary study is related to volunteered geographic information, but it is not related to quality assessment; ",,,,,,
421,Success & Scale in a Data-Producing Organization: The Socio-Technical Evolution of OpenStreetMap in Response to Humanitarian Events,"Palen, Leysia and Soden, Robert and Anderson, T. Jennings and Barrenechea, Mario",REJECTED,UNCLASSIFIED,2015,33rd Annual ACM Conference on Human Factors in Computing Systems,"(E2) the primary study is related to volunteered geographic information, but it is not related to quality assessment; ",,,,,,
422,Suggestive Geo-Tagging Assistance for Geo-Collaboration Tools,"Austerschulte, Marius and Kessler, Carsten",REJECTED,UNCLASSIFIED,2010,Geospatial Thinking,"(E2) the primary study is related to volunteered geographic information, but it is not related to quality assessment; ",,,,,,
423,"Supervised models for multimodal image retrieval based on visual, semantic and geographic information","Dang-Nguyen, D.-T.; Boato, G.; Moschitti, A. & De Natale, F.",REJECTED,UNCLASSIFIED,2012,10th International Workshop on Content-Based Multimedia Indexing ,(E9) the primary study is not related to quality assessment or volunteered geographic information; ,,,,,,
424,Supporting Urban Energy Efficiency with Volunteered Roof Information andthe Google Maps API,"Abdulkarim, Bilal and Kamberov, Rustam and Hay, Geoffrey J.",REJECTED,UNCLASSIFIED,2014,Remote Sensing,"(E2) the primary study is related to volunteered geographic information, but it is not related to quality assessment; ",,,,,,
425,TAREEG: A MapReduce-based System for Extracting Spatial Data from OpenStreetMap,"Alarabi, Louai and Eldawy, Ahmed and Alghamdi, Rami and Mokbel, Mohamed F.",REJECTED,UNCLASSIFIED,2014,22nd  ACM  SIGSPATIAL  International  Conference on  Advances in  Geographic  Information  Systems,"(E2) the primary study is related to volunteered geographic information, but it is not related to quality assessment; ",,,,,,
426,Temporal  Analysis of  Activity  Patterns of  Editors in  Collaborative  Mapping  Project of  OpenStreetMap,"Yasseri, Taha and Quattrone, Giovanni and Mashhadi, Afra",REJECTED,UNCLASSIFIED,2013,9th  International  Symposium on  Open  Collaboration,"(E2) the primary study is related to volunteered geographic information, but it is not related to quality assessment; ",,,,,,
427,"Testing the Accuracy of Topographic Maps at the Scale of 1:25000 published by the Military Geographical Institute, Belgrade ","Pucekovic, B.",REJECTED,UNCLASSIFIED,2014,Geodetski List,"(E1) the primary study is related to quality assessment, but it is not related to volunteered geographic information; ",,,,,,
428,Text and the city,"Yap, T.",REJECTED,UNCLASSIFIED,2014,BJU International,(E6) the primary study is incomplete; ,,,,,,
429,The  One and  Many  Maps:  Participatory and  Temporal  Diversities in  OpenStreetMap,"Chuang, Tyng-Ruey and Deng, Dong-Po and Hsu, Chun-Chen and Lemmens, Rob",REJECTED,UNCLASSIFIED,2013,2nd  ACM  SIGSPATIAL  International  Workshop on  Crowdsourced and  Volunteered  Geographic  Information,"(E2) the primary study is related to volunteered geographic information, but it is not related to quality assessment; ",,,,,,
430,The city of New Orleans blight fight: Using GIS technology to integrate local knowledge,"Thompson, M.M.",REJECTED,UNCLASSIFIED,2012,Housing Policy Debate,"(E2) the primary study is related to volunteered geographic information, but it is not related to quality assessment; ",,,,,,
431,The geolocation of web logs from textual clues,"Fink, C.a  and Piatko, C.a  and Mayfield, J.a  and Chou, D.a  and Finin, T.b  and Martineau, J.b ",REJECTED,UNCLASSIFIED,2009,12th IEEE International Conference on Computational Science and Engineering,(E9) the primary study is not related to quality assessment or volunteered geographic information; ,,,,,,
432,The point cadastre requirement revisited,"Hackman-Antwi, R. and Bennett, R.M. and de Vries, W.T. and Lemmen, C.H.J. and Meijer, C.",REJECTED,UNCLASSIFIED,2013,Survey Review,(E9) the primary study is not related to quality assessment or volunteered geographic information; ,,,,,,
433,The potential and early limitations of volunteered geographic information,"Coleman, D.J.",REJECTED,UNCLASSIFIED,2010,Geomatica,"(E2) the primary study is related to volunteered geographic information, but it is not related to quality assessment; ",,,,,,
434,The role of mobile volunteered geographic information in urban management,"Song, W. and Sun, G.",REJECTED,UNCLASSIFIED,2010,18th International Conference on Geoinformatics,"(E2) the primary study is related to volunteered geographic information, but it is not related to quality assessment; ",,,,,,
435,The role of VGI and PGI in supporting outdoor activities,"Parker, C.J. and May, A. and Mitchell, V.",REJECTED,UNCLASSIFIED,2013,Applied Ergonomics,"(E2) the primary study is related to volunteered geographic information, but it is not related to quality assessment; ",,,,,,
436,The San Francisco Public Art Map application: Using VGI and social media to complement institutional data sources,"Milholland, N. and Pultar, E.",REJECTED,UNCLASSIFIED,2013,1st ACM SIGSPATIAL International Workshop on MapInteraction,"(E2) the primary study is related to volunteered geographic information, but it is not related to quality assessment; ",,,,,,
